{
  "schemaVersion": "1.0.0",
  "exportId": "77777777-7777-4777-8777-777777777777",
  "productId": "11111111-1111-4111-8111-111111111111",
  "createdAt": "2026-10-29T12:00:00Z",
  "appVersion": "UNBUILT",
  "approvedOnly": true,
  "files": [
    {
      "path": "originals/synthetic-source.png",
      "sha256": "aaaaaaaaaaaaaaaaaaaaaaaaaaaaaaaaaaaaaaaaaaaaaaaaaaaaaaaaaaaaaaaa",
      "bytes": 12345,
      "mimeType": "image/png",
      "approved": false,
      "role": "original",
      "sourceAssetId": "33333333-3333-4333-8333-333333333333",
      "attemptId": null,
      "qaId": null
    }
  ]
}
